{
  "$schema": "https://json-schema.org/draft/2020-12/schema",
  "type": "array",
  "items": {
    "type": "object",
    "properties": {
      "id": {
        "type": "string",
        "pattern": "^[a-z0-9]+(?:-[a-z0-9]+)*$"
      },
      "title": {
        "type": "string",
        "pattern": "\\S"
      },
      "description": {
        "type": "string",
        "pattern": "\\S"
      },
      "hidden": {
        "type": "boolean"
      },
      "when": {
        "$ref": "#/$defs/__schema0"
      }
    },
    "required": [
      "id",
      "title",
      "description",
      "hidden",
      "when"
    ],
    "additionalProperties": false
  },
  "$defs": {
    "__schema0": {
      "anyOf": [
        {
          "$ref": "#/$defs/__schema1"
        },
        {
          "type": "object",
          "properties": {
            "endingReached": {
              "type": "string",
              "pattern": "^[a-z0-9]+(?:-[a-z0-9]+)*$"
            }
          },
          "required": [
            "endingReached"
          ],
          "additionalProperties": false
        },
        {
          "type": "object",
          "properties": {
            "timedUnderMs": {
              "type": "integer",
              "exclusiveMinimum": 0,
              "maximum": 9007199254740991
            }
          },
          "required": [
            "timedUnderMs"
          ],
          "additionalProperties": false
        },
        {
          "type": "object",
          "properties": {
            "allSecrets": {
              "type": "boolean",
              "const": true
            }
          },
          "required": [
            "allSecrets"
          ],
          "additionalProperties": false
        },
        {
          "type": "object",
          "properties": {
            "all": {
              "minItems": 1,
              "type": "array",
              "items": {
                "$ref": "#/$defs/__schema0"
              }
            }
          },
          "required": [
            "all"
          ],
          "additionalProperties": false
        },
        {
          "type": "object",
          "properties": {
            "any": {
              "minItems": 1,
              "type": "array",
              "items": {
                "$ref": "#/$defs/__schema0"
              }
            }
          },
          "required": [
            "any"
          ],
          "additionalProperties": false
        },
        {
          "type": "object",
          "properties": {
            "not": {
              "$ref": "#/$defs/__schema0"
            }
          },
          "required": [
            "not"
          ],
          "additionalProperties": false
        }
      ]
    },
    "__schema1": {
      "anyOf": [
        {
          "type": "object",
          "properties": {
            "read": {
              "type": "string",
              "pattern": "^[a-z0-9]+(?:-[a-z0-9]+)*$"
            }
          },
          "required": [
            "read"
          ],
          "additionalProperties": false
        },
        {
          "type": "object",
          "properties": {
            "unlocked": {
              "type": "string",
              "pattern": "^[a-z0-9]+(?:-[a-z0-9]+)*$"
            }
          },
          "required": [
            "unlocked"
          ],
          "additionalProperties": false
        },
        {
          "type": "object",
          "properties": {
            "searched": {
              "type": "string",
              "pattern": "^[a-z0-9]+(?:-[a-z0-9]+)*$"
            }
          },
          "required": [
            "searched"
          ],
          "additionalProperties": false
        },
        {
          "type": "object",
          "properties": {
            "visited": {
              "type": "string",
              "pattern": "^[a-z0-9]+(?:-[a-z0-9]+)*$"
            }
          },
          "required": [
            "visited"
          ],
          "additionalProperties": false
        },
        {
          "type": "object",
          "properties": {
            "locked": {
              "type": "string",
              "pattern": "^[a-z0-9]+(?:-[a-z0-9]+)*$"
            }
          },
          "required": [
            "locked"
          ],
          "additionalProperties": false
        },
        {
          "type": "object",
          "properties": {
            "groupLocked": {
              "type": "string",
              "pattern": "^[a-z0-9]+(?:-[a-z0-9]+)*$"
            }
          },
          "required": [
            "groupLocked"
          ],
          "additionalProperties": false
        },
        {
          "type": "object",
          "properties": {
            "secret": {
              "type": "string",
              "pattern": "^[a-z0-9]+(?:-[a-z0-9]+)*$"
            }
          },
          "required": [
            "secret"
          ],
          "additionalProperties": false
        },
        {
          "type": "object",
          "properties": {
            "lockedCount": {
              "type": "object",
              "properties": {
                "gte": {
                  "type": "integer",
                  "minimum": 0,
                  "maximum": 9007199254740991
                }
              },
              "required": [
                "gte"
              ],
              "additionalProperties": false
            }
          },
          "required": [
            "lockedCount"
          ],
          "additionalProperties": false
        },
        {
          "type": "object",
          "properties": {
            "answered": {
              "type": "object",
              "properties": {
                "question": {
                  "type": "string",
                  "pattern": "^[a-z0-9]+(?:-[a-z0-9]+)*$"
                },
                "option": {
                  "type": "string",
                  "pattern": "^[a-z0-9]+(?:-[a-z0-9]+)*$"
                }
              },
              "required": [
                "question",
                "option"
              ],
              "additionalProperties": false
            }
          },
          "required": [
            "answered"
          ],
          "additionalProperties": false
        },
        {
          "type": "object",
          "properties": {
            "not": {
              "$ref": "#/$defs/__schema1"
            }
          },
          "required": [
            "not"
          ],
          "additionalProperties": false
        },
        {
          "type": "object",
          "properties": {
            "all": {
              "minItems": 1,
              "type": "array",
              "items": {
                "$ref": "#/$defs/__schema1"
              }
            }
          },
          "required": [
            "all"
          ],
          "additionalProperties": false
        },
        {
          "type": "object",
          "properties": {
            "any": {
              "minItems": 1,
              "type": "array",
              "items": {
                "$ref": "#/$defs/__schema1"
              }
            }
          },
          "required": [
            "any"
          ],
          "additionalProperties": false
        }
      ]
    }
  }
}
